{
  "type": "hyperedge",
  "id": "h-0008",
  "stream": "proof-hierarchies",
  "sources": [
    {
      "kind": "A",
      "id": "a-0006"
    }
  ],
  "target": "q-0009",
  "rationale": "Variant B / planner - the surviving remnant of the original proof-planning motivation.",
  "provenance": {
    "created_by": "claude",
    "created_at": "2026-06-11T12:02:35.249Z",
    "updated_at": "2026-06-11T12:02:35.249Z"
  },
  "comments": {}
}
