{
  "type": "hyperedge",
  "id": "h-0009",
  "stream": "visualization-tools-putnam",
  "sources": [
    {
      "kind": "A",
      "id": "a-0014"
    }
  ],
  "target": "q-0010",
  "rationale": "The objective-oracle audit shows the LLM judge cannot move any cross-study conclusion, but the pre-registered defense (human grader, Cohen's kappa >= 0.6) remains uncomputed because grade.py was never run and all samples/*.csv your_grade fields are empty. The 85 stratified sample cells are already drawn and ready; only the human grading pass is missing.",
  "provenance": {
    "created_by": "claude",
    "created_at": "2026-06-17T04:02:37.341Z",
    "updated_at": "2026-06-17T04:02:37.341Z"
  },
  "comments": {}
}
