{
  "type": "hyperedge",
  "id": "h-0002",
  "stream": "proof-hierarchies",
  "sources": [
    {
      "kind": "Q",
      "id": "q-0002"
    }
  ],
  "target": "q-0003",
  "rationale": "Without machine-verified reconstruction there is no trustworthy corpus.",
  "provenance": {
    "created_by": "claude",
    "created_at": "2026-06-11T12:02:19.343Z",
    "updated_at": "2026-06-11T12:02:19.343Z"
  },
  "comments": {}
}
