{
  "type": "hyperedge",
  "id": "h-0007",
  "stream": "mathematical-domain-topology",
  "sources": [
    {
      "kind": "A",
      "id": "a-0007"
    }
  ],
  "target": "q-0008",
  "rationale": "Validation against the only available external ground truth: known historical bridges.",
  "provenance": {
    "created_by": "claude",
    "created_at": "2026-06-11T04:13:13.518Z",
    "updated_at": "2026-06-11T04:13:13.518Z"
  },
  "comments": {}
}
