{
  "type": "hyperedge",
  "id": "h-0013",
  "stream": "mathematical-domain-topology",
  "sources": [
    {
      "kind": "A",
      "id": "a-0006"
    }
  ],
  "target": "q-0014",
  "rationale": "Asks whether the bridge construct (a-0006) beats simple centrality/import baselines; reviewer open question.",
  "provenance": {
    "created_by": "claude",
    "created_at": "2026-06-17T03:51:39.538Z",
    "updated_at": "2026-06-17T03:51:39.538Z"
  },
  "comments": {}
}
