{
  "type": "hyperedge",
  "id": "h-0002",
  "stream": "visualization-tools-putnam",
  "sources": [
    {
      "kind": "A",
      "id": "a-0001"
    }
  ],
  "target": "q-0003",
  "rationale": "If the tool is never adopted, perhaps the lever is how the problem is FRAMED to the agent (Lean syntax vs prose) - chasing an anecdote that Lean framing pulls in general math tools.",
  "provenance": {
    "created_by": "claude",
    "created_at": "2026-06-11T01:49:22.281Z",
    "updated_at": "2026-06-11T01:49:22.281Z"
  },
  "comments": {}
}
