{
  "type": "hyperedge",
  "id": "h-0005",
  "stream": "mathematical-domain-topology",
  "sources": [
    {
      "kind": "A",
      "id": "a-0001"
    },
    {
      "kind": "A",
      "id": "a-0002"
    }
  ],
  "target": "q-0006",
  "rationale": "Core construct: operationalize a bridge via shared premises across domains.",
  "provenance": {
    "created_by": "claude",
    "created_at": "2026-06-11T04:13:10.038Z",
    "updated_at": "2026-06-11T04:13:10.038Z"
  },
  "comments": {}
}
