{
  "type": "hyperedge",
  "id": "h-0005",
  "stream": "math-world-models",
  "sources": [
    {
      "kind": "A",
      "id": "a-0004"
    }
  ],
  "target": "q-0006",
  "rationale": "The direct HWM ablation: do high-level world models help long-horizon planning?",
  "provenance": {
    "created_by": "claude",
    "created_at": "2026-06-11T11:01:28.165Z",
    "updated_at": "2026-06-11T11:01:28.165Z"
  },
  "comments": {}
}
