{
  "type": "hyperedge",
  "id": "h-0008",
  "stream": "math-world-models",
  "sources": [
    {
      "kind": "A",
      "id": "a-0004"
    }
  ],
  "target": "q-0009",
  "rationale": "The HWM antidote to compounding model error, ported to ITP.",
  "provenance": {
    "created_by": "claude",
    "created_at": "2026-06-11T11:01:29.880Z",
    "updated_at": "2026-06-11T11:01:29.880Z"
  },
  "comments": {}
}
