{
  "type": "hyperedge",
  "id": "h-0006",
  "stream": "slitherlink-tool-granularity",
  "sources": [
    {
      "kind": "Q",
      "id": "q-0006"
    },
    {
      "kind": "A",
      "id": "a-0005"
    }
  ],
  "target": "q-0007",
  "rationale": "The 15x15 ceiling and medium's case-split bookkeeping overhead motivate testing engine-level bookkeeping and lookahead.",
  "provenance": {
    "created_by": "claude",
    "created_at": "2026-06-03T03:47:38.481Z",
    "updated_at": "2026-06-03T03:47:38.481Z",
    "source_ref": {
      "repo": "claude-sudoku-experiments",
      "commit": "0e31a015d8dab3348b6f48fdca81191e4ff97aa6"
    }
  },
  "comments": {}
}
