{
  "type": "hyperedge",
  "id": "h-0012",
  "stream": "slitherlink-tool-granularity",
  "sources": [
    {
      "kind": "Q",
      "id": "q-0001"
    }
  ],
  "target": "q-0013",
  "rationale": "Ideated facet of q-0001 (local scope): the cost/solve-rate axes are well covered, but q-0001 is about agent BEHAVIOR. Whether granularity changes the *kind* of failure (not just the rate) is non-obvious and gets at behavior directly.",
  "provenance": {
    "created_by": "claude",
    "created_at": "2026-06-10T23:45:01.824Z",
    "updated_at": "2026-06-10T23:45:01.824Z"
  },
  "comments": {}
}
