{
  "type": "hyperedge",
  "id": "h-0005",
  "stream": "proof-hierarchies",
  "sources": [
    {
      "kind": "Q",
      "id": "q-0003"
    }
  ],
  "target": "q-0006",
  "rationale": "Stage 0.5 gate: establish the infrastructure and the no-SFT baseline floor.",
  "provenance": {
    "created_by": "claude",
    "created_at": "2026-06-11T12:02:28.420Z",
    "updated_at": "2026-06-11T12:02:28.420Z"
  },
  "comments": {}
}
