{
  "type": "hyperedge",
  "id": "h-0005",
  "stream": "slitherlink-tool-granularity",
  "sources": [
    {
      "kind": "A",
      "id": "a-0004"
    }
  ],
  "target": "q-0006",
  "rationale": "With the gate passed and the benefit shown to be difficulty-conditional, map where toolsets fail across the difficulty axis.",
  "provenance": {
    "created_by": "claude",
    "created_at": "2026-06-03T03:47:36.562Z",
    "updated_at": "2026-06-03T03:47:36.562Z",
    "source_ref": {
      "repo": "claude-sudoku-experiments",
      "commit": "0e31a015d8dab3348b6f48fdca81191e4ff97aa6"
    }
  },
  "comments": {}
}
