{
  "type": "hyperedge",
  "id": "h-0025",
  "stream": "mathematical-domain-topology",
  "sources": [
    {
      "kind": "A",
      "id": "a-0008"
    }
  ],
  "target": "q-0026",
  "rationale": "Asks for the selection criterion behind the 8-of-34 discussed bridges (a-0008); reviewer concern.",
  "provenance": {
    "created_by": "claude",
    "created_at": "2026-06-17T03:52:21.649Z",
    "updated_at": "2026-06-17T03:52:21.649Z"
  },
  "comments": {}
}
